{
  "schema_version": 1,
  "kind": "auth.status",
  "data": {
    "site": "rec",
    "account": "env",
    "username": "student1",
    "user_id": "4",
    "full_name": "Sam Student",
    "site_name": "Dockerized_Moodle",
    "release": "5.1.7 (Build: 20260914)",
    "valid": true
  },
  "meta": {
    "site": null,
    "account": null,
    "source": "ws",
    "partial": false,
    "missing": [],
    "next_cursor": null
  }
}
